id,chats
1,"Customer contacted support regarding TechWorld Pro Buds experiencing connectivity issues with their phone. The conversation revealed frustration with the product's inability to maintain a stable Bluetooth connection. The agent provided clear, step-by-step troubleshooting instructions that successfully resolved the pairing problem, demonstrating technical competence and patience throughout the interaction."
2,"Customer received a blue summer dress that was too small and needed to exchange the item for a larger size. This represents a common e-commerce challenge where sizing expectations don't match the actual product received. The agent handled the exchange request efficiently, maintained a professional and courteous demeanor, and ensured a quick resolution that left the customer feeling valued."
3,"Customer reached out about a damaged coffee mug that arrived chipped. This shipping or quality control issue directly impacts customer satisfaction. The agent immediately offered a replacement without requiring complicated return procedures. The helpful, professional approach and swift resolution transformed a potentially damaging experience into a positive interaction."
4,"A new lead called for information about our premium subscription plan. I explained the features, including unlimited access to our content library and priority customer support. They were particularly interested in the pricing structure for a team of 15 users. I sent them a detailed quote via email, which includes a 10% discount for annual billing. I also set a calendar reminder to follow up with them next week to answer any further questions. The lead's name is John Smith, and the company is "Innovate Solutions LLC"
5,"Followed up with the client about their outstanding service request. The ticket number is SR-45678. The client indicated that the issue with their internet service had resolved itself, but they were concerned about a recurring disconnection problem. I scheduled a technician visit for this Friday between 9 AM and 1 PM to diagnose the root cause. I confirmed the appointment details and provided the technician's name, David. The client was happy to have a definite plan in place."
6,"Customer needed to update their shipping address for an order that was already in process. This time-sensitive request required immediate attention to prevent delivery to the wrong location. The agent provided clear instructions on how to update the shipping information and confirmed the changes were applied successfully before the package shipped out."
7,"Customer contacted support expressing frustration about not receiving a promotional discount code that was advertised in an email campaign. The customer felt misled by the marketing communication and was upset about the pricing discrepancy. The agent apologized for the confusion, validated the customer's concerns, manually applied the discount to their pending order, and escalated the issue to the marketing team to prevent future occurrences."
8,"Customer was confused about the return policy and refund timeline after initiating a return for a wireless keyboard. They wanted clarity on when they would receive their refund and whether return shipping would be covered. The agent patiently explained the complete return process, provided a prepaid return label, and gave a specific timeline of 5-7 business days for refund processing once the item was received at the warehouse."
9,"Customer reported difficulty logging into their account after multiple failed password reset attempts. They expressed concern about account security and whether their personal information had been compromised. The agent verified the customer's identity through security questions, manually reset the account password, enabled two-factor authentication for added security, and walked the customer through the login process to ensure everything was working properly."
10,"Customer contacted support seeking information about loyalty program benefits and how to redeem accumulated reward points. They were interested in understanding tier levels and what exclusive perks were available. The agent explained the entire rewards structure, showed the customer their current point balance, demonstrated how to apply points at checkout, and informed them they were close to reaching the next tier level which would unlock free shipping benefits."